{
  "style_name": "Neon Kinetic Typographic Poster",
  "style_slug": "neon-kinetic-typographic-poster-style",
  "style_version": "1.0.0",
  "style_summary": "A dramatic outdoor editorial poster style combining low-angle lifestyle photography, oversized warped neon typography, film grain, and high-energy youth-culture campaign design.",
  "environment_variables": {
    "SUBJECT": "main human figure or object",
    "SUBJECT_ACTION": "dynamic action performed by the subject",
    "PRODUCT_OR_PROP": "object held, worn, used, or displayed by the subject",
    "LOCATION": "outdoor environment or contextual scene",
    "BACKGROUND_ELEMENTS": "sky, hills, architecture, crowd, stage lights, roads, rocks, grass, clouds, dust, or other secondary scenery",
    "MAIN_TEXT": "large repeated headline word or phrase",
    "SECONDARY_TEXT": "small repeating line of text",
    "ACCENT_SYMBOL": "small separator icon such as diamond, dot, slash, star, or warning mark",
    "WARDROBE_STYLE": "streetwear, outdoor fashion, sportswear, festival outfit, or editorial styling",
    "ASPECT_RATIO": "9:16 vertical poster or 16:9 horizontal banner"
  },
  "style_fidelity_anchors": [
    "Preserve the core visual identity: A dramatic outdoor editorial poster style combining low-angle lifestyle photography, oversized warped neon typography, film grain, and high-energy youth-culture campaign design.",
    "Use BACKGROUND_ELEMENTS to control secondary scene details, textures, signage, props, and environmental cues.",
    "Use an extreme low-angle wide-angle camera perspective, as if the camera is near the ground looking upward.",
    "Add oversized warped neon yellow typography using MAIN_TEXT.",
    "The typography should wrap around the composition and sit behind or partially around the subject.",
    "Use electric neon yellow graphics, warm sunlit photographic tones, blue sky contrast, visible film grain, analog print texture, hard shadows, and an energetic youth-culture campaign poster mood.",
    "Avoid clean corporate design, small typography, flat illustration, pastel colors, luxury minimalism, and symmetrical static layout.",
    "Keep the same visual genre, density level, and rendering mode across new subjects."
  ],
  "source_content_to_avoid": [
    "small typography",
    "clean corporate layout",
    "symmetrical centered poster design",
    "flat vector illustration",
    "pastel palette",
    "luxury minimalism",
    "soft studio lighting",
    "plain white background",
    "low contrast",
    "overly polished 3D render",
    "generic stock photo",
    "tiny subject"
  ],
  "visual_deconstruction": {
    "style_category": "A dramatic outdoor editorial poster style combining low-angle lifestyle photography, oversized warped neon typography, film grain, and high-energy youth-culture campaign design.",
    "composition_logic": "A reusable poster/image system where the subject, prop, location, text, and accent variables change while the layout grammar remains fixed.",
    "subject_treatment": "The subject is driven by SUBJECT and SUBJECT_ACTION, with wardrobe or visual treatment supplied by WARDROBE_STYLE.",
    "background_system": "LOCATION and BACKGROUND_ELEMENTS provide the scene, texture, spatial cues, and secondary details without changing the style family.",
    "type_and_graphics": "MAIN_TEXT, SECONDARY_TEXT, and ACCENT_SYMBOL control readable text, microcopy, stickers, marks, arrows, bursts, or other graphic accents.",
    "content_boundary": "The negative prompt and source_content_to_avoid list prevent direct recreation of source subjects, marks, brands, watermarks, and story premises."
  },
  "image_treatment": {
    "rendering_mode": "photographic collage",
    "finish": "finished AI-image prompt output, not a wireframe, SVG, HTML mockup, or raw storyboard note",
    "texture": "preserve the material, paper, grain, marker, photographic, or print texture described by the style summary and prompt_template",
    "lighting": "keep the lighting behavior implied by the reference style rather than replacing it with a generic cinematic look"
  },
  "composition": {
    "layout": "Keep the subject hierarchy, crop behavior, framing, and density described by the prompt_template.",
    "subject": "Use SUBJECT and SUBJECT_ACTION as the primary visual anchor, scaled and positioned according to the style identity.",
    "scene": "Use LOCATION and BACKGROUND_ELEMENTS for setting detail without changing the visual genre.",
    "text": "Place MAIN_TEXT and SECONDARY_TEXT as designed graphic elements, not as long paragraphs."
  },
  "typography": {
    "main_text": "MAIN_TEXT should be short, legible, and visually integrated with the poster or image system.",
    "secondary_text": "SECONDARY_TEXT should read as small caption, label, route note, slogan, or microcopy.",
    "style": "Match the typography behavior described by the style summary and prompt_template, including scale, distortion, texture, and placement."
  },
  "color_palette": {
    "palette_behavior": "Use the dominant colors, contrast rhythm, and accent-color logic implied by the style summary.",
    "background": "Keep the background color family consistent with the reference style.",
    "accents": "Use ACCENT_SYMBOL and graphic marks to carry small high-contrast color moments."
  },
  "design_rules": [
    "Use SUBJECT as the main visual focus.",
    "Use SUBJECT_ACTION to define the visible pose, gesture, or moment.",
    "Use PRODUCT_OR_PROP as the prop, product cue, or foreground object.",
    "Use LOCATION to define the setting while keeping the style-specific crop and atmosphere.",
    "Use BACKGROUND_ELEMENTS to control secondary scene details, textures, signage, props, and environmental cues.",
    "Use an extreme low-angle wide-angle camera perspective, as if the camera is near the ground looking upward.",
    "The subject should feel large, energetic, and close to the viewer."
  ],
  "do": [
    "Replace subjects, props, locations, text, and story details through examples.values.",
    "Keep prompt_template placeholders declared in environment_variables.",
    "Preserve the style_fidelity_anchors when adapting the JSON to a new image request.",
    "Use short, readable text values for MAIN_TEXT and SECONDARY_TEXT."
  ],
  "avoid": [
    "small typography",
    "clean corporate layout",
    "symmetrical centered poster design",
    "flat vector illustration",
    "pastel palette",
    "luxury minimalism",
    "soft studio lighting",
    "plain white background"
  ],
  "prompt_template": "Create a {ASPECT_RATIO} poster in the \"Neon Kinetic Typographic Poster\" style.\n\nMain subject: {SUBJECT}.\nAction: {SUBJECT_ACTION}.\nProp or product: {PRODUCT_OR_PROP}.\nLocation: {LOCATION}.\nBackground elements: {BACKGROUND_ELEMENTS}.\nWardrobe or styling: {WARDROBE_STYLE}.\n\nUse an extreme low-angle wide-angle camera perspective, as if the camera is near the ground looking upward. The subject should feel large, energetic, and close to the viewer.\n\nAdd oversized warped neon yellow typography using the main text \"{MAIN_TEXT}\". The letters should be ultra-bold, condensed, stretched, slanted, and partially cropped by the canvas edges. The typography should wrap around the composition and sit behind or partially around the subject.\n\nAdd a thin repeated uppercase text band reading \"{SECONDARY_TEXT}\", separated by \"{ACCENT_SYMBOL}\" symbols. The secondary text should run horizontally across the image like a campaign graphic stripe.\n\nUse electric neon yellow graphics, warm sunlit photographic tones, blue sky contrast, visible film grain, analog print texture, hard shadows, and an energetic youth-culture campaign poster mood.\n\nAvoid clean corporate design, small typography, flat illustration, pastel colors, luxury minimalism, and symmetrical static layout.",
  "negative_prompt": "Avoid small typography, clean corporate layout, symmetrical centered poster design, flat vector illustration, pastel palette, luxury minimalism, soft studio lighting, plain white background, low contrast, overly polished 3D render, generic stock photo, tiny subject, unreadable clutter, and text that covers the subject's key action or product.",
  "examples": [
    {
      "case_name": "Drink Campaign",
      "values": {
        "SUBJECT": "a street dancer holding a chilled citrus can",
        "SUBJECT_ACTION": "jumping toward the lens from a sunlit court",
        "PRODUCT_OR_PROP": "neon citrus drink can with condensation",
        "LOCATION": "outdoor basketball court below a blue sky",
        "BACKGROUND_ELEMENTS": "low-angle pavement, motion blur, warped neon type, lens flare, and film grain",
        "MAIN_TEXT": "BURST",
        "SECONDARY_TEXT": "cold energy",
        "ACCENT_SYMBOL": "electric pink underline",
        "WARDROBE_STYLE": "oversized windbreaker, sporty shorts, bright socks, and reflective sunglasses"
      }
    },
    {
      "case_name": "Skate Poster",
      "values": {
        "SUBJECT": "a skateboarder in a green hoodie",
        "SUBJECT_ACTION": "launching a kickflip above the camera",
        "PRODUCT_OR_PROP": "scratched skateboard deck with sticker underside",
        "LOCATION": "concrete skate plaza at noon",
        "BACKGROUND_ELEMENTS": "wide-angle sky, rail shadows, neon warped lettering, grain, and sun flare",
        "MAIN_TEXT": "FLIP NOW",
        "SECONDARY_TEXT": "street series",
        "ACCENT_SYMBOL": "orange arrow streak",
        "WARDROBE_STYLE": "baggy skatewear, scuffed sneakers, hoodie strings, and high-contrast street styling"
      }
    },
    {
      "case_name": "Music Festival",
      "values": {
        "SUBJECT": "a singer reaching over a crowd barrier",
        "SUBJECT_ACTION": "leaning into the lens with a silver microphone",
        "PRODUCT_OR_PROP": "chrome handheld microphone",
        "LOCATION": "daytime outdoor music festival stage",